{
  "agency": {
    "id": "black-ball-ferry-line",
    "name": "Black Ball Ferry Line"
  },
  "autofix": {
    "available": false
  },
  "categories": {
    "completeness": {
      "details": {
        "accessibility": {
          "measures": "presence_not_usability",
          "score": 100.0,
          "stops_marked_accessible_pct": 100.0,
          "stops_marked_not_accessible_pct": 0.0,
          "stops_stated_pct": 100.0,
          "trips_stated_pct": 100.0
        },
        "accessibility_measures": "presence_not_usability",
        "components": {
          "contact": 15.0,
          "fares": 15.0,
          "headsigns": 15.0,
          "stop_names": 15.0,
          "wheelchair_stops": 25.0,
          "wheelchair_trips": 15.0
        },
        "fare_free": false,
        "fares": {
          "applied": true,
          "has_leg_rules": false,
          "has_products": false,
          "has_transfer_rules": false,
          "model": "legacy",
          "product_count": 0
        },
        "flex": {
          "booking_reachable": false,
          "booking_rule_count": 0,
          "has_booking_rules": false,
          "has_flex": false
        },
        "has_fares": true,
        "headsign_pct": 100.0,
        "mixed_case_stop_name_pct": 100.0,
        "pathways": {
          "has_entrances": false,
          "has_levels": false,
          "has_pathways": false,
          "has_stations": false,
          "has_step_free": false,
          "pathway_count": 0
        },
        "stops": 2,
        "trips": 33,
        "wheelchair_accessible_pct": 100.0,
        "wheelchair_boarding_pct": 100.0,
        "wheelchair_marked_accessible_pct": 100.0,
        "wheelchair_marked_not_accessible_pct": 0.0
      },
      "findings": [],
      "name": "completeness",
      "score": 100.0,
      "status": "measured",
      "summary": "100% of stops state wheelchair accessibility (100% marked accessible, 0% marked not accessible). This measures what the feed publishes, not whether a stop is physically usable. Fare data is published.",
      "weight": 0.25
    },
    "correctness": {
      "details": {
        "distinct_codes": 1,
        "instances_by_severity": {
          "ERROR": 0,
          "INFO": 0,
          "WARNING": 3
        },
        "validator_version": "8.0.1"
      },
      "findings": [
        {
          "code": "expired_calendar",
          "count": 3,
          "effort": "One setting in most export tools.",
          "fix": "Remove past service periods the next time you export the feed.",
          "owner": "Likely your export tool",
          "points": 4.0,
          "severity": "WARNING",
          "what": "Some service calendars in the feed have already expired.",
          "why": "Expired calendars are dead weight and can hide real schedule problems from your staff and vendors."
        }
      ],
      "name": "correctness",
      "score": 96.0,
      "status": "measured",
      "summary": "The MobilityData validator flagged 1 kind of issue across 3 instances (0 error, 3 warning, 0 informational).",
      "weight": 0.35
    },
    "freshness": {
      "details": {
        "days_until_expiry": 186,
        "feed_end_date": "2027-01-03",
        "feed_start_date": "2026-03-03",
        "feed_version": "20260303",
        "has_feed_info": true,
        "last_service_date": "2027-01-04",
        "service_type": "fixed"
      },
      "findings": [],
      "name": "freshness",
      "score": 100.0,
      "status": "measured",
      "summary": "Service data covers the next 186 days.",
      "weight": 0.2
    },
    "realtime": {
      "name": "realtime",
      "status": "not_yet_measured",
      "summary": "Not scored yet. Nothing here counts against the grade.",
      "weight": 0.2
    }
  },
  "conformance": {
    "awarded": true,
    "criteria": [
      {
        "detail": "Passes validation with no errors.",
        "key": "valid",
        "met": true
      },
      {
        "detail": "Service data covers the next 190 days.",
        "key": "current",
        "met": true
      },
      {
        "detail": "States wheelchair access on 100% of stops and 100% of trips.",
        "key": "accessible",
        "met": true
      }
    ],
    "status": "awarded",
    "summary": "This feed earns the conformance mark: valid, current, and stating wheelchair access on nearly every stop and trip."
  },
  "feed": {
    "license_note": "No stated data license in the Mobility Database; verify before publishing.",
    "reachable": true,
    "sha256": "f69e71f3704c8013a008dee5ac6067fcbd9b59605e111f889f50362f28eaceed",
    "size_bytes": 5459,
    "static_url": "https://mjcaction.com/MJC_GTFS_Public/blackball_google_transit.zip"
  },
  "generated_at": "2026-06-27T00:00:00+00:00",
  "geo": {
    "bbox": [
      -123.43175,
      48.12089,
      -123.37225,
      48.42165
    ],
    "lat": 48.27127,
    "lon": -123.402,
    "stop_count": 2
  },
  "ntd_id_alignment": {
    "detail": "If you report to the National Transit Database, your GTFS agency_id should be your five-digit NTD ID by report year 2026 (2025 for full reporters). We don't have your NTD ID on file, so this one is not checked yet.",
    "feed_agency_ids": [
      "blackball"
    ],
    "status": "unknown"
  },
  "ntd_readiness": {
    "pillars": [
      {
        "detail": "Published at a public URL.",
        "key": "published",
        "status": "ready"
      },
      {
        "detail": "Passes validation with no errors.",
        "key": "valid",
        "status": "ready"
      },
      {
        "detail": "Service data covers the next 190 days.",
        "key": "current",
        "status": "ready"
      }
    ],
    "status": "ready",
    "summary": "This feed looks ready for your NTD certification: published at a public URL, valid, and current. The official check is still your D-10 certification."
  },
  "overall": {
    "grade": "A",
    "score": 98.2
  },
  "recommendations": [
    {
      "code": "scorecard_route_color_low_contrast",
      "count": 1,
      "effort": "A per-route color setting in your scheduling software.",
      "fix": "Adjust route_color or route_text_color so each pair clears 4.5:1. Often switching the text between black and white is enough.",
      "owner": "Likely your export tool",
      "points": 0.0,
      "severity": "WARNING",
      "what": "1 route badge(s) pair a color and text color below the WCAG 4.5:1 contrast bar (Coho).",
      "why": "Low-contrast route badges are hard to read for riders with low vision and wash out on a phone screen in sunlight at the stop."
    }
  ],
  "recompute": {
    "as_of": "2026-07-01",
    "feed_fetched_date": "2026-06-30",
    "kind": "freshness"
  },
  "routability": {
    "boardable_stops": 2,
    "findings": [],
    "orphan_stops": 0,
    "single_stop_trips": 0,
    "trips_total": 33
  },
  "rubric_version": "1.1",
  "schema_version": "1.4",
  "snapshot_date": "2026-07-01",
  "top_fixes": [
    {
      "code": "expired_calendar",
      "count": 3,
      "effort": "One setting in most export tools.",
      "fix": "Remove past service periods the next time you export the feed.",
      "owner": "Likely your export tool",
      "points": 4.0,
      "rank": 1,
      "severity": "WARNING",
      "what": "Some service calendars in the feed have already expired.",
      "why": "Expired calendars are dead weight and can hide real schedule problems from your staff and vendors."
    }
  ],
  "validator_version": "8.0.1"
}
