{
  "agency": {
    "id": "bloomington-transit-2066",
    "name": "Bloomington Transit"
  },
  "categories": {
    "completeness": {
      "details": {
        "accessibility": {
          "measures": "presence_not_usability",
          "score": 0.0,
          "stops_marked_accessible_pct": 0.0,
          "stops_marked_not_accessible_pct": 0.0,
          "stops_stated_pct": 0.0,
          "trips_stated_pct": 0.0
        },
        "accessibility_measures": "presence_not_usability",
        "components": {
          "contact": 7.5,
          "fares": 15.0,
          "headsigns": 15.0,
          "stop_names": 15.0,
          "wheelchair_stops": 0.0,
          "wheelchair_trips": 0.0
        },
        "fare_free": false,
        "fares": {
          "applied": true,
          "has_leg_rules": false,
          "has_products": false,
          "has_transfer_rules": false,
          "model": "legacy",
          "product_count": 0
        },
        "flex": {
          "booking_reachable": false,
          "booking_rule_count": 0,
          "has_booking_rules": false,
          "has_flex": false
        },
        "has_fares": true,
        "headsign_pct": 100.0,
        "mixed_case_stop_name_pct": 100.0,
        "pathways": {
          "has_entrances": false,
          "has_levels": false,
          "has_pathways": false,
          "has_stations": false,
          "has_step_free": false,
          "pathway_count": 0
        },
        "stops": 467,
        "trips": 1000,
        "wheelchair_accessible_pct": 0.0,
        "wheelchair_boarding_pct": 0.0,
        "wheelchair_marked_accessible_pct": 0.0,
        "wheelchair_marked_not_accessible_pct": 0.0
      },
      "findings": [
        {
          "code": "scorecard_wheelchair_boarding_unknown",
          "count": 467,
          "effort": "A column in stops.txt; your scheduling software likely has it.",
          "fix": "Set wheelchair_boarding to 1 (accessible) or 2 (not accessible) for every stop. A field survey can start with the busiest stops.",
          "owner": "Likely your team",
          "points": 25.0,
          "severity": "WARNING",
          "what": "467 of 467 stops don't say whether a wheelchair user can board there.",
          "why": "Riders who use wheelchairs can't plan a trip when accessibility is marked 'unknown'; apps show no information at all."
        },
        {
          "code": "scorecard_wheelchair_accessible_unknown",
          "count": 1000,
          "effort": "Often one default setting in your export.",
          "fix": "Set wheelchair_accessible on every trip (most small-agency fleets are 100% accessible, so this is often a single default).",
          "owner": "Likely your export tool",
          "points": 15.0,
          "severity": "WARNING",
          "what": "1000 of 1000 trips don't say whether the vehicle is wheelchair accessible.",
          "why": "Even with accessible stops, riders need to know the bus itself can take them."
        },
        {
          "code": "scorecard_no_feed_contact",
          "count": 1,
          "effort": "One field.",
          "fix": "Add feed_contact_email to feed_info.txt.",
          "owner": "",
          "points": 7.5,
          "severity": "INFO",
          "what": "feed_info.txt has no technical contact (feed_contact_email or feed_contact_url).",
          "why": "App makers and state data programs have nobody to email when they spot a problem with your feed, so problems linger."
        }
      ],
      "name": "completeness",
      "score": 52.5,
      "status": "measured",
      "summary": "0% of stops state wheelchair accessibility (0% marked accessible, 0% marked not accessible). This measures what the feed publishes, not whether a stop is physically usable. Fare data is published.",
      "weight": 0.25
    },
    "correctness": {
      "details": {
        "distinct_codes": 5,
        "instances_by_severity": {
          "ERROR": 0,
          "INFO": 3,
          "WARNING": 120
        },
        "validator_version": "8.0.1"
      },
      "findings": [
        {
          "code": "fast_travel_between_consecutive_stops",
          "count": 106,
          "effort": "A few minutes per flagged trip.",
          "fix": "Check the flagged stop times for transposed minutes.",
          "owner": "",
          "points": 8.0,
          "severity": "WARNING",
          "what": "Some scheduled trips travel implausibly fast between stops.",
          "why": "Usually a typo'd stop time; riders get impossible arrival estimates."
        },
        {
          "code": "stop_without_stop_time",
          "count": 12,
          "effort": "A review pass in your scheduling software.",
          "fix": "Remove retired stops from the export, or add them back to the trips that should serve them.",
          "owner": "Likely your export tool",
          "points": 6.0,
          "severity": "WARNING",
          "what": "Some stops exist in the feed but no trip ever stops at them.",
          "why": "Riders may walk to a stop where no bus is scheduled to arrive."
        },
        {
          "code": "missing_feed_contact_email_and_url",
          "count": 1,
          "effort": "Varies.",
          "fix": "Review the rule documentation for 'missing_feed_contact_email_and_url' at https://gtfs-validator.mobilitydata.org/rules.html and check the flagged rows in your feed.",
          "owner": "",
          "points": 4.0,
          "severity": "WARNING",
          "what": "Missing feed contact email and url (flagged by the MobilityData validator).",
          "why": "See the linked rule for what this affects."
        },
        {
          "code": "missing_recommended_field",
          "count": 1,
          "effort": "A field at a time; not urgent.",
          "fix": "Review the flagged fields and fill in the ones your riders would use.",
          "owner": "",
          "points": 4.0,
          "severity": "WARNING",
          "what": "Some files are missing recommended (not required) fields.",
          "why": "Recommended fields like agency_phone or stop descriptions make the feed more useful to riders and trip planners."
        },
        {
          "code": "unknown_column",
          "count": 3,
          "effort": "A quick look at the flagged files.",
          "fix": "Check the flagged column names for misspellings of standard GTFS fields; remove them if they are vendor extras.",
          "owner": "",
          "points": 0.5,
          "severity": "INFO",
          "what": "Some files contain columns that are not part of the GTFS spec.",
          "why": "Harmless to riders, but apps ignore these columns and they can hide typos in real column names."
        }
      ],
      "name": "correctness",
      "score": 77.5,
      "status": "measured",
      "summary": "The MobilityData validator flagged 5 kinds of issue across 123 instances (0 error, 120 warning, 3 informational).",
      "weight": 0.35
    },
    "freshness": {
      "details": {
        "days_until_expiry": 360,
        "feed_end_date": "2027-06-15",
        "feed_start_date": "2026-06-01",
        "feed_version": "96",
        "has_feed_info": true,
        "last_service_date": "2027-06-15",
        "service_type": "fixed"
      },
      "findings": [],
      "name": "freshness",
      "score": 100.0,
      "status": "measured",
      "summary": "Service data covers the next 360 days.",
      "weight": 0.2
    },
    "realtime": {
      "name": "realtime",
      "status": "not_yet_measured",
      "summary": "Not scored yet. Nothing here counts against the grade.",
      "weight": 0.2
    }
  },
  "feed": {
    "license_note": "No stated data license in the Mobility Database; verify before publishing.",
    "reachable": true,
    "sha256": "8c0335231f4d803a3baf149f607114bd32ce0187665e5bc9dcb76a9c26acb932",
    "size_bytes": 424755,
    "static_url": "https://s3.amazonaws.com/etatransit.gtfs/bloomingtontransit.etaspot.net/gtfs.zip"
  },
  "generated_at": "2026-06-20T00:00:00+00:00",
  "overall": {
    "grade": "C",
    "score": 75.3
  },
  "rubric_version": "1.1",
  "schema_version": "1.4",
  "snapshot_date": "2026-06-20",
  "top_fixes": [
    {
      "code": "scorecard_wheelchair_boarding_unknown",
      "count": 467,
      "effort": "A column in stops.txt; your scheduling software likely has it.",
      "fix": "Set wheelchair_boarding to 1 (accessible) or 2 (not accessible) for every stop. A field survey can start with the busiest stops.",
      "owner": "Likely your team",
      "points": 25.0,
      "rank": 1,
      "severity": "WARNING",
      "what": "467 of 467 stops don't say whether a wheelchair user can board there.",
      "why": "Riders who use wheelchairs can't plan a trip when accessibility is marked 'unknown'; apps show no information at all."
    },
    {
      "code": "scorecard_wheelchair_accessible_unknown",
      "count": 1000,
      "effort": "Often one default setting in your export.",
      "fix": "Set wheelchair_accessible on every trip (most small-agency fleets are 100% accessible, so this is often a single default).",
      "owner": "Likely your export tool",
      "points": 15.0,
      "rank": 2,
      "severity": "WARNING",
      "what": "1000 of 1000 trips don't say whether the vehicle is wheelchair accessible.",
      "why": "Even with accessible stops, riders need to know the bus itself can take them."
    },
    {
      "code": "fast_travel_between_consecutive_stops",
      "count": 106,
      "effort": "A few minutes per flagged trip.",
      "fix": "Check the flagged stop times for transposed minutes.",
      "owner": "",
      "points": 8.0,
      "rank": 3,
      "severity": "WARNING",
      "what": "Some scheduled trips travel implausibly fast between stops.",
      "why": "Usually a typo'd stop time; riders get impossible arrival estimates."
    }
  ],
  "validator_version": "8.0.1"
}
