{
  "agency": {
    "id": "farmville-area-bus",
    "name": "Farmville Area Bus"
  },
  "categories": {
    "completeness": {
      "details": {
        "accessibility": {
          "measures": "presence_not_usability",
          "score": 0.0,
          "stops_marked_accessible_pct": 0.0,
          "stops_marked_not_accessible_pct": 0.0,
          "stops_stated_pct": 0.0,
          "trips_stated_pct": 0.0
        },
        "accessibility_measures": "presence_not_usability",
        "components": {
          "contact": 15.0,
          "fares": 15.0,
          "headsigns": 10.6,
          "stop_names": 15.0,
          "wheelchair_stops": 0.0,
          "wheelchair_trips": 0.0
        },
        "fare_free": false,
        "fares": {
          "applied": true,
          "has_leg_rules": false,
          "has_products": false,
          "has_transfer_rules": false,
          "model": "legacy",
          "product_count": 0
        },
        "flex": {
          "booking_reachable": false,
          "booking_rule_count": 0,
          "has_booking_rules": false,
          "has_flex": false
        },
        "has_fares": true,
        "headsign_pct": 70.6,
        "mixed_case_stop_name_pct": 100.0,
        "pathways": {
          "has_entrances": false,
          "has_levels": false,
          "has_pathways": false,
          "has_stations": false,
          "has_step_free": false,
          "pathway_count": 0
        },
        "stops": 100,
        "trips": 197,
        "wheelchair_accessible_pct": 0.0,
        "wheelchair_boarding_pct": 0.0,
        "wheelchair_marked_accessible_pct": 0.0,
        "wheelchair_marked_not_accessible_pct": 0.0
      },
      "findings": [
        {
          "code": "scorecard_wheelchair_boarding_unknown",
          "count": 100,
          "effort": "A column in stops.txt; your scheduling software likely has it.",
          "fix": "Set wheelchair_boarding to 1 (accessible) or 2 (not accessible) for every stop. A field survey can start with the busiest stops.",
          "owner": "Likely your team",
          "points": 25.0,
          "severity": "WARNING",
          "what": "100 of 100 stops don't say whether a wheelchair user can board there.",
          "why": "Riders who use wheelchairs can't plan a trip when accessibility is marked 'unknown'; apps show no information at all."
        },
        {
          "code": "scorecard_wheelchair_accessible_unknown",
          "count": 197,
          "effort": "Often one default setting in your export.",
          "fix": "Set wheelchair_accessible on every trip (most small-agency fleets are 100% accessible, so this is often a single default).",
          "owner": "Likely your export tool",
          "points": 15.0,
          "severity": "WARNING",
          "what": "197 of 197 trips don't say whether the vehicle is wheelchair accessible.",
          "why": "Even with accessible stops, riders need to know the bus itself can take them."
        },
        {
          "code": "scorecard_missing_headsigns",
          "count": 58,
          "effort": "Usually a bulk edit in your scheduling software.",
          "fix": "Populate trip_headsign to match what the bus displays.",
          "owner": "Likely your export tool",
          "points": 4.4,
          "severity": "WARNING",
          "what": "58 of 197 trips have no headsign.",
          "why": "Riders at the stop can't tell which direction a bus is going."
        }
      ],
      "name": "completeness",
      "score": 55.6,
      "status": "measured",
      "summary": "0% of stops state wheelchair accessibility (0% marked accessible, 0% marked not accessible). This measures what the feed publishes, not whether a stop is physically usable. Fare data is published.",
      "weight": 0.25
    },
    "correctness": {
      "details": {
        "distinct_codes": 3,
        "instances_by_severity": {
          "ERROR": 0,
          "INFO": 0,
          "WARNING": 9
        },
        "validator_version": "8.0.1"
      },
      "findings": [
        {
          "code": "trip_distance_exceeds_shape_distance_below_threshold",
          "count": 6,
          "effort": "Varies.",
          "fix": "Review the rule documentation for 'trip_distance_exceeds_shape_distance_below_threshold' at https://gtfs-validator.mobilitydata.org/rules.html and check the flagged rows in your feed.",
          "owner": "",
          "points": 6.0,
          "severity": "WARNING",
          "what": "Trip distance exceeds shape distance below threshold (flagged by the MobilityData validator).",
          "why": "See the linked rule for what this affects."
        },
        {
          "code": "expired_calendar",
          "count": 2,
          "effort": "One setting in most export tools.",
          "fix": "Remove past service periods the next time you export the feed.",
          "owner": "Likely your export tool",
          "points": 4.0,
          "severity": "WARNING",
          "what": "Some service calendars in the feed have already expired.",
          "why": "Expired calendars are dead weight and can hide real schedule problems from your staff and vendors."
        },
        {
          "code": "trip_coverage_not_active_for_next7_days",
          "count": 1,
          "effort": "One setting in most export tools.",
          "fix": "Trim past service periods the next time you export.",
          "owner": "Likely your export tool",
          "points": 4.0,
          "severity": "WARNING",
          "what": "Many of the feed's trips don't run at all in the next 7 days.",
          "why": "It usually means old service periods are still in the export, making the feed bigger and harder to check."
        }
      ],
      "name": "correctness",
      "score": 86.0,
      "status": "measured",
      "summary": "The MobilityData validator flagged 3 kinds of issue across 9 instances (0 error, 9 warning, 0 informational).",
      "weight": 0.35
    },
    "freshness": {
      "details": {
        "days_until_expiry": 42,
        "feed_end_date": "2026-08-01",
        "feed_start_date": "2026-01-27",
        "feed_version": "UTC: 28-Jan-2026 00:03",
        "has_feed_info": true,
        "last_service_date": "2026-08-01",
        "service_type": "fixed"
      },
      "findings": [],
      "name": "freshness",
      "score": 70.0,
      "status": "measured",
      "summary": "Service data covers the next 42 days.",
      "weight": 0.2
    },
    "realtime": {
      "name": "realtime",
      "status": "not_yet_measured",
      "summary": "Not scored yet. Nothing here counts against the grade.",
      "weight": 0.2
    }
  },
  "feed": {
    "license_note": "No stated data license in the Mobility Database; verify before publishing.",
    "reachable": true,
    "sha256": "4cb189fc32d17ab99e7cf17d07f477049b462a47c24434f56cf219ef9d95ae76",
    "size_bytes": 306870,
    "static_url": "https://data.trilliumtransit.com/gtfs/farmville-va-us/farmville-va-us.zip"
  },
  "generated_at": "2026-06-20T00:00:00+00:00",
  "overall": {
    "grade": "C",
    "score": 72.5
  },
  "rubric_version": "1.1",
  "schema_version": "1.4",
  "snapshot_date": "2026-06-20",
  "top_fixes": [
    {
      "code": "scorecard_wheelchair_boarding_unknown",
      "count": 100,
      "effort": "A column in stops.txt; your scheduling software likely has it.",
      "fix": "Set wheelchair_boarding to 1 (accessible) or 2 (not accessible) for every stop. A field survey can start with the busiest stops.",
      "owner": "Likely your team",
      "points": 25.0,
      "rank": 1,
      "severity": "WARNING",
      "what": "100 of 100 stops don't say whether a wheelchair user can board there.",
      "why": "Riders who use wheelchairs can't plan a trip when accessibility is marked 'unknown'; apps show no information at all."
    },
    {
      "code": "scorecard_wheelchair_accessible_unknown",
      "count": 197,
      "effort": "Often one default setting in your export.",
      "fix": "Set wheelchair_accessible on every trip (most small-agency fleets are 100% accessible, so this is often a single default).",
      "owner": "Likely your export tool",
      "points": 15.0,
      "rank": 2,
      "severity": "WARNING",
      "what": "197 of 197 trips don't say whether the vehicle is wheelchair accessible.",
      "why": "Even with accessible stops, riders need to know the bus itself can take them."
    },
    {
      "code": "trip_distance_exceeds_shape_distance_below_threshold",
      "count": 6,
      "effort": "Varies.",
      "fix": "Review the rule documentation for 'trip_distance_exceeds_shape_distance_below_threshold' at https://gtfs-validator.mobilitydata.org/rules.html and check the flagged rows in your feed.",
      "owner": "",
      "points": 6.0,
      "rank": 3,
      "severity": "WARNING",
      "what": "Trip distance exceeds shape distance below threshold (flagged by the MobilityData validator).",
      "why": "See the linked rule for what this affects."
    }
  ],
  "validator_version": "8.0.1"
}
