{
  "agency": {
    "id": "yankee-line",
    "name": "Yankee Line"
  },
  "autofix": {
    "available": false
  },
  "categories": {
    "completeness": {
      "details": {
        "accessibility": {
          "measures": "presence_not_usability",
          "score": 0.0,
          "stops_marked_accessible_pct": 0.0,
          "stops_marked_not_accessible_pct": 0.0,
          "stops_stated_pct": 0.0,
          "trips_stated_pct": 0.0
        },
        "accessibility_measures": "presence_not_usability",
        "components": {
          "contact": 15.0,
          "fares": 15.0,
          "headsigns": 15.0,
          "stop_names": 15.0,
          "wheelchair_stops": 0.0,
          "wheelchair_trips": 0.0
        },
        "fare_free": false,
        "fares": {
          "applied": true,
          "has_leg_rules": false,
          "has_products": false,
          "has_transfer_rules": false,
          "model": "legacy",
          "product_count": 0
        },
        "flex": {
          "booking_reachable": false,
          "booking_rule_count": 0,
          "has_booking_rules": false,
          "has_flex": false
        },
        "has_fares": true,
        "headsign_pct": 100.0,
        "mixed_case_stop_name_pct": 100.0,
        "pathways": {
          "has_entrances": false,
          "has_levels": false,
          "has_pathways": false,
          "has_stations": false,
          "has_step_free": false,
          "pathway_count": 0
        },
        "stops": 3,
        "trips": 4,
        "wheelchair_accessible_pct": 0.0,
        "wheelchair_boarding_pct": 0.0,
        "wheelchair_marked_accessible_pct": 0.0,
        "wheelchair_marked_not_accessible_pct": 0.0
      },
      "findings": [
        {
          "code": "scorecard_wheelchair_boarding_unknown",
          "count": 3,
          "effort": "A column in stops.txt; your scheduling software likely has it.",
          "fix": "Set wheelchair_boarding to 1 (accessible) or 2 (not accessible) for every stop. A field survey can start with the busiest stops.",
          "owner": "Likely your team",
          "points": 25.0,
          "severity": "WARNING",
          "what": "3 of 3 stops don't say whether a wheelchair user can board there.",
          "why": "Riders who use wheelchairs can't plan a trip when accessibility is marked 'unknown'; apps show no information at all."
        },
        {
          "code": "scorecard_wheelchair_accessible_unknown",
          "count": 4,
          "effort": "Often one default setting in your export.",
          "fix": "Set wheelchair_accessible on every trip (most small-agency fleets are 100% accessible, so this is often a single default).",
          "owner": "Likely your export tool",
          "points": 15.0,
          "severity": "WARNING",
          "what": "4 of 4 trips don't say whether the vehicle is wheelchair accessible.",
          "why": "Even with accessible stops, riders need to know the bus itself can take them."
        }
      ],
      "name": "completeness",
      "score": 60.0,
      "status": "measured",
      "summary": "0% of stops state wheelchair accessibility (0% marked accessible, 0% marked not accessible). This measures what the feed publishes, not whether a stop is physically usable. Fare data is published.",
      "weight": 0.25
    },
    "correctness": {
      "details": {
        "distinct_codes": 0,
        "instances_by_severity": {
          "ERROR": 0,
          "INFO": 0,
          "WARNING": 0
        },
        "validator_version": "8.0.1"
      },
      "findings": [],
      "name": "correctness",
      "score": 100.0,
      "status": "measured",
      "summary": "The validator found no problems in this feed. That is rare and worth celebrating.",
      "weight": 0.35
    },
    "freshness": {
      "details": {
        "days_until_expiry": 93,
        "feed_end_date": "2026-10-01",
        "feed_start_date": "2026-02-27",
        "feed_version": "UTC: 27-Feb-2026 21:06",
        "has_feed_info": true,
        "last_service_date": "2026-10-01",
        "service_type": "fixed"
      },
      "findings": [],
      "name": "freshness",
      "score": 100.0,
      "status": "measured",
      "summary": "Service data covers the next 93 days.",
      "weight": 0.2
    },
    "realtime": {
      "name": "realtime",
      "status": "not_yet_measured",
      "summary": "Not scored yet. Nothing here counts against the grade.",
      "weight": 0.2
    }
  },
  "conformance": {
    "awarded": false,
    "criteria": [
      {
        "detail": "Passes validation with no errors.",
        "key": "valid",
        "met": true
      },
      {
        "detail": "Service data covers the next 96 days.",
        "key": "current",
        "met": true
      },
      {
        "detail": "States wheelchair access on 0% of stops and 0% of trips; the mark needs 90% of each.",
        "key": "accessible",
        "met": false
      }
    ],
    "status": "not_yet",
    "summary": "This feed is close to the conformance mark. States wheelchair access on 0% of stops and 0% of trips; the mark needs 90% of each."
  },
  "feed": {
    "license_note": "No stated data license in the Mobility Database; verify before publishing.",
    "reachable": true,
    "sha256": "b2a74064f9418c0451466a91d62a4b772333d5d5e95107f67fca2187c2d97876",
    "size_bytes": 36611,
    "static_url": "https://data.trilliumtransit.com/gtfs/yankeeline-ma-us/yankeeline-ma-us.zip"
  },
  "generated_at": "2026-06-27T00:00:00+00:00",
  "geo": {
    "bbox": [
      -71.41137,
      42.34985,
      -71.0751,
      42.47776
    ],
    "lat": 42.45482,
    "lon": -71.35693,
    "stop_count": 3
  },
  "ntd_id_alignment": {
    "detail": "If you report to the National Transit Database, your GTFS agency_id should be your five-digit NTD ID by report year 2026 (2025 for full reporters). We don't have your NTD ID on file, so this one is not checked yet.",
    "feed_agency_ids": [
      "614"
    ],
    "status": "unknown"
  },
  "ntd_readiness": {
    "pillars": [
      {
        "detail": "Published at a public URL.",
        "key": "published",
        "status": "ready"
      },
      {
        "detail": "Passes validation with no errors.",
        "key": "valid",
        "status": "ready"
      },
      {
        "detail": "Service data covers the next 96 days.",
        "key": "current",
        "status": "ready"
      }
    ],
    "status": "ready",
    "summary": "This feed looks ready for your NTD certification: published at a public URL, valid, and current. The official check is still your D-10 certification."
  },
  "overall": {
    "grade": "B",
    "score": 87.5
  },
  "recommendations": [
    {
      "code": "scorecard_stop_name_needs_tts",
      "count": 3,
      "effort": "A short text field per affected stop; start with the busiest.",
      "fix": "Add tts_stop_name with the spoken form, e.g. 'Main Street and Second Avenue', for the affected stops.",
      "owner": "",
      "points": 0.0,
      "severity": "INFO",
      "what": "3 stop name(s) use abbreviations or symbols a screen reader may mispronounce, with no spoken form set (\"Acton, MA - Rt. 119 & 2A (Behind Tedeschi's - 75 Great Rd.)\", \"Concord, MA - Crosby's Supermarket (211 Sudbury Rd.)\", \"Boston, MA - Copley Square (Corner of Clarendon St. & St. James Ave. in front of Trinity Church)\").",
      "why": "Riders who use a screen reader hear the raw name, so 'Main St & 2nd Ave' can come out as 'Main saint' or drop the ampersand."
    }
  ],
  "recompute": {
    "as_of": "2026-06-30",
    "feed_fetched_date": "2026-06-29",
    "kind": "freshness"
  },
  "routability": {
    "boardable_stops": 3,
    "findings": [],
    "orphan_stops": 0,
    "single_stop_trips": 0,
    "trips_total": 4
  },
  "rubric_version": "1.1",
  "schema_version": "1.4",
  "snapshot_date": "2026-06-30",
  "top_fixes": [
    {
      "code": "scorecard_wheelchair_boarding_unknown",
      "count": 3,
      "effort": "A column in stops.txt; your scheduling software likely has it.",
      "fix": "Set wheelchair_boarding to 1 (accessible) or 2 (not accessible) for every stop. A field survey can start with the busiest stops.",
      "owner": "Likely your team",
      "points": 25.0,
      "rank": 1,
      "severity": "WARNING",
      "what": "3 of 3 stops don't say whether a wheelchair user can board there.",
      "why": "Riders who use wheelchairs can't plan a trip when accessibility is marked 'unknown'; apps show no information at all."
    },
    {
      "code": "scorecard_wheelchair_accessible_unknown",
      "count": 4,
      "effort": "Often one default setting in your export.",
      "fix": "Set wheelchair_accessible on every trip (most small-agency fleets are 100% accessible, so this is often a single default).",
      "owner": "Likely your export tool",
      "points": 15.0,
      "rank": 2,
      "severity": "WARNING",
      "what": "4 of 4 trips don't say whether the vehicle is wheelchair accessible.",
      "why": "Even with accessible stops, riders need to know the bus itself can take them."
    }
  ],
  "validator_version": "8.0.1"
}
