{
  "agency": {
    "id": "san-joaquin-regional-transit-district-rtd",
    "name": "San Joaquin Regional Transit District (RTD)"
  },
  "categories": {
    "completeness": {
      "details": {
        "accessibility": {
          "measures": "presence_not_usability",
          "score": 37.5,
          "stops_marked_accessible_pct": 0.0,
          "stops_marked_not_accessible_pct": 0.0,
          "stops_stated_pct": 0.0,
          "trips_stated_pct": 100.0
        },
        "accessibility_measures": "presence_not_usability",
        "components": {
          "contact": 15.0,
          "fares": 15.0,
          "headsigns": 15.0,
          "stop_names": 15.0,
          "wheelchair_stops": 0.0,
          "wheelchair_trips": 15.0
        },
        "fare_free": false,
        "fares": {
          "applied": true,
          "has_leg_rules": true,
          "has_products": true,
          "has_transfer_rules": true,
          "model": "v2",
          "product_count": 50
        },
        "flex": {
          "booking_reachable": false,
          "booking_rule_count": 0,
          "has_booking_rules": false,
          "has_flex": false
        },
        "has_fares": true,
        "headsign_pct": 100.0,
        "mixed_case_stop_name_pct": 100.0,
        "pathways": {
          "has_entrances": false,
          "has_levels": false,
          "has_pathways": false,
          "has_stations": false,
          "has_step_free": false,
          "pathway_count": 0
        },
        "stops": 870,
        "trips": 2351,
        "wheelchair_accessible_pct": 100.0,
        "wheelchair_boarding_pct": 0.0,
        "wheelchair_marked_accessible_pct": 0.0,
        "wheelchair_marked_not_accessible_pct": 0.0
      },
      "findings": [
        {
          "code": "scorecard_wheelchair_boarding_unknown",
          "count": 870,
          "effort": "A column in stops.txt; your scheduling software likely has it.",
          "fix": "Set wheelchair_boarding to 1 (accessible) or 2 (not accessible) for every stop. A field survey can start with the busiest stops.",
          "owner": "Likely your team",
          "points": 25.0,
          "severity": "WARNING",
          "what": "870 of 870 stops don't say whether a wheelchair user can board there.",
          "why": "Riders who use wheelchairs can't plan a trip when accessibility is marked 'unknown'; apps show no information at all."
        },
        {
          "code": "scorecard_missing_headsigns",
          "count": 1,
          "effort": "Usually a bulk edit in your scheduling software.",
          "fix": "Populate trip_headsign to match what the bus displays.",
          "owner": "Likely your export tool",
          "points": 0.0,
          "severity": "WARNING",
          "what": "1 of 2351 trips have no headsign.",
          "why": "Riders at the stop can't tell which direction a bus is going."
        }
      ],
      "name": "completeness",
      "score": 75.0,
      "status": "measured",
      "summary": "0% of stops state wheelchair accessibility (0% marked accessible, 0% marked not accessible). This measures what the feed publishes, not whether a stop is physically usable. Fare data is published.",
      "weight": 0.25
    },
    "correctness": {
      "details": {
        "distinct_codes": 5,
        "instances_by_severity": {
          "ERROR": 0,
          "INFO": 0,
          "WARNING": 398
        },
        "validator_version": "8.0.1"
      },
      "findings": [
        {
          "code": "stop_too_far_from_shape_using_user_distance",
          "count": 352,
          "effort": "Varies.",
          "fix": "Review the rule documentation for 'stop_too_far_from_shape_using_user_distance' at https://gtfs-validator.mobilitydata.org/rules.html and check the flagged rows in your feed.",
          "owner": "",
          "points": 8.0,
          "severity": "WARNING",
          "what": "Stop too far from shape using user distance (flagged by the MobilityData validator).",
          "why": "See the linked rule for what this affects."
        },
        {
          "code": "fast_travel_between_consecutive_stops",
          "count": 30,
          "effort": "A few minutes per flagged trip.",
          "fix": "Check the flagged stop times for transposed minutes.",
          "owner": "",
          "points": 6.0,
          "severity": "WARNING",
          "what": "Some scheduled trips travel implausibly fast between stops.",
          "why": "Usually a typo'd stop time; riders get impossible arrival estimates."
        },
        {
          "code": "stop_too_far_from_shape",
          "count": 13,
          "effort": "A few minutes per flagged stop.",
          "fix": "Check the flagged stops' coordinates and the route shape in your scheduling software; re-snap whichever is misplaced.",
          "owner": "Likely your export tool",
          "points": 6.0,
          "severity": "WARNING",
          "what": "Some stops sit far from the route line they belong to.",
          "why": "Trip planners may draw the bus route through the wrong streets or point riders to the wrong corner."
        },
        {
          "code": "stops_match_shape_out_of_order",
          "count": 2,
          "effort": "Varies.",
          "fix": "Review the rule documentation for 'stops_match_shape_out_of_order' at https://gtfs-validator.mobilitydata.org/rules.html and check the flagged rows in your feed.",
          "owner": "",
          "points": 4.0,
          "severity": "WARNING",
          "what": "Stops match shape out of order (flagged by the MobilityData validator).",
          "why": "See the linked rule for what this affects."
        },
        {
          "code": "service_has_no_active_day_of_the_week",
          "count": 1,
          "effort": "A few minutes in your scheduling software.",
          "fix": "Delete the empty calendars or set their service days.",
          "owner": "Likely your export tool",
          "points": 4.0,
          "severity": "WARNING",
          "what": "Some service calendars have no days of the week switched on.",
          "why": "Trips tied to these calendars never run; they are dead data that can mask real schedule problems."
        }
      ],
      "name": "correctness",
      "score": 72.0,
      "status": "measured",
      "summary": "The MobilityData validator flagged 5 kinds of issue across 398 instances (0 error, 398 warning, 0 informational).",
      "weight": 0.35
    },
    "freshness": {
      "details": {
        "days_until_expiry": 35,
        "feed_end_date": "2026-07-25",
        "feed_start_date": "2026-05-31",
        "feed_version": "20260531-20260725",
        "has_feed_info": true,
        "last_service_date": "2026-07-25",
        "service_type": "fixed"
      },
      "findings": [],
      "name": "freshness",
      "score": 58.3,
      "status": "measured",
      "summary": "Service data covers the next 35 days.",
      "weight": 0.2
    },
    "realtime": {
      "name": "realtime",
      "status": "not_yet_measured",
      "summary": "This agency publishes realtime, but the feed needs an access key we don't have yet. Nothing here counts against the grade.",
      "weight": 0.2
    }
  },
  "feed": {
    "license_note": "License: http://sanjoaquinrtd.com/preview/terms-of-use/",
    "reachable": true,
    "sha256": "8bc55825b6356b9d6eae4d92268dc7015e775b612aacd4bdd445d27660b0cd3c",
    "size_bytes": 1414857,
    "static_url": "http://sjrtd.com/RTD-GTFS/RTD-GTFS.zip"
  },
  "generated_at": "2026-06-20T00:00:00+00:00",
  "overall": {
    "grade": "D",
    "score": 69.5
  },
  "rubric_version": "1.1",
  "schema_version": "1.4",
  "snapshot_date": "2026-06-20",
  "top_fixes": [
    {
      "code": "scorecard_wheelchair_boarding_unknown",
      "count": 870,
      "effort": "A column in stops.txt; your scheduling software likely has it.",
      "fix": "Set wheelchair_boarding to 1 (accessible) or 2 (not accessible) for every stop. A field survey can start with the busiest stops.",
      "owner": "Likely your team",
      "points": 25.0,
      "rank": 1,
      "severity": "WARNING",
      "what": "870 of 870 stops don't say whether a wheelchair user can board there.",
      "why": "Riders who use wheelchairs can't plan a trip when accessibility is marked 'unknown'; apps show no information at all."
    },
    {
      "code": "stop_too_far_from_shape_using_user_distance",
      "count": 352,
      "effort": "Varies.",
      "fix": "Review the rule documentation for 'stop_too_far_from_shape_using_user_distance' at https://gtfs-validator.mobilitydata.org/rules.html and check the flagged rows in your feed.",
      "owner": "",
      "points": 8.0,
      "rank": 2,
      "severity": "WARNING",
      "what": "Stop too far from shape using user distance (flagged by the MobilityData validator).",
      "why": "See the linked rule for what this affects."
    },
    {
      "code": "fast_travel_between_consecutive_stops",
      "count": 30,
      "effort": "A few minutes per flagged trip.",
      "fix": "Check the flagged stop times for transposed minutes.",
      "owner": "",
      "points": 6.0,
      "rank": 3,
      "severity": "WARNING",
      "what": "Some scheduled trips travel implausibly fast between stops.",
      "why": "Usually a typo'd stop time; riders get impossible arrival estimates."
    }
  ],
  "validator_version": "8.0.1"
}
